source,title,link,content,journalist,date
동아일보,"한국계 첫 美이민법원 판사, 이메일로 해임",https://n.news.naver.com/mnews/article/020/0003662172?sid=102,"데이비드 김, 사건 심리중 통보 받아 “높은 망명신청 인용률에 불만” 분석 한국계 미국인 최초로 미국 연방이민법원 판사로 임명돼 뉴욕 연방이민법원에서 활동해 온 데이비드 김(김광수·사진) 판사가 이달 초 해임된 것으로 알려졌다. 김 판사는 서울에서 태어났고, 고등학생이던 16세 때 미국으로 이민을 갔다. 그는 2022년 판사로 임용되기 전까지 이민법 분야 전문 변호사로 활동해왔다. 일각에선 도널드 트럼프 행정부가 김 판사의 높은 망명 신청 인용률에 불만을 가졌고, 이것이 해임에 영향을 줬을 것이란 분석이 나온다. 뉴욕 현지 매체인 더시티에 따르면 이달 4일 김 판사는 망명 사건 심리를 진행하던 중 법무부 이민심사행정국(EOIR)으로부터 “오늘부로 해임된다”는 이메일을 받았다. 해임 사유에 대해선 명확한 설명이 없었다. 그저 ‘행정권은 미합중국 대통령에게 속한다’는 헌법 2조가 해임 근거였다. 스페인계 미국인으로 트럼프 대통령에게 비판적이었던 레이 칼다스 판사 또한 같은 이유로 해임 통보를 받았다. 더시티는 “사법행정데이터센터 자료에 따르면 김 판사는 뉴욕 이민법원 판사들 가운데 망명 인용률이 가장 높았다”고 설명했다. 김 판사가 트럼프 행정부의 반(反)이민 정책과 반대로 심리한 게 해임의 이유일 수 있다는 것이다. 김 판사는 소셜미디어에 해임 사실을 알리며 “지금의 미국은 제가 처음 도착했을 때와는 많이 다르다. 그러나 저는 여전히 이 나라가 위대한 나라라고 믿으며, 정의와 민주주의가 반드시 승리할 것이라고 믿는다”고 전했다. 김 판사는 에머리대에서 물리학과 철학을 전공한 뒤 브루클린로스쿨에서 법학 박사 학위를 받았다. 2002년 변호사 자격증을 취득한 뒤에는 뉴욕에서 법률사무소를 운영하며 이민 문제를 주로 다뤄왔다.",이기욱 기자,2025.09.19. 오전 3:04
이데일리,"트럼프, 유엔 총회 흔들다…反이민·기후변화 부정 ‘원맨쇼’(종합)",https://n.news.naver.com/mnews/article/018/0006123653?sid=104,"“7개 전쟁 끝내” 자화자찬…유엔엔 “빈말만 한다” 맹공 불법이민·난민지원 비판…“국경 위협·주권 침해” 주장 이재명 “내외국인 동등한 존중”…외신, 정반대 발언 주목 경제 성과 자찬..“美, 세계서 가장 뜨거운 나라” 강조 기후변화·재생에너지 부정…“역사상 최대 사기극” [뉴욕=이데일리 김상윤 특파원] 도널드 트럼프 미국 대통령은 23일(현지시간) 뉴욕 유엔본부에서 열린 제80차 유엔 총회 연설에서 자신이 “7개의 전쟁을 끝냈다”고 주장하며 유엔을 강하게 비판했다. 그는 기후변화를 “세계 최대 사기극”이라 규정하고, 개방적 이민 정책은 국가를 파괴한다고 목소리를 높였다. 국제사회의 공동 어젠다를 정면으로 반박하며 미국 우선주의(MAGA)를 전면에 내세운 것이다. 약 한 시간 동안 이어진 연설에서 청중은 대부분 침묵으로 반응했으나, 몇 차례 웃음과 탄식이 터져 나오기도 했다. 도널드 트럼프 미국 대통령이 23일(현지시간) 뉴욕 유엔 본부에서 열린 제80차 유엔 총회에서 연설을 하고 있다. (사진=AFP) ◇유엔 총회 연설서 맹비난...“유엔, 빈말만 내놓는다” 트럼프 대통령은 이날 연설에서 유엔이 불법 이민을 지원하고 전 세계 분쟁 해결을 도와주지 않았다며 “유엔은 빈말만 내놓는다”고 일갈했다. 그는 연설 도중 퍼스트레이디 멜라니아 여사가 이용한 에스컬레이터 고장과 텔레프롬프터 오작동을 거론하며 “유엔에서 얻은 것은 고장 난 에스컬레이터와 고장 난 프롬프터뿐”이라고 비꼬았다. 또 과거 자신이 추진한 유엔 본부 리모델링 계획이 거부된 일을 다시 언급했다. 이어 “나는 7개의 전쟁을 종식시켰고 각국 정상들과 직접 협의했지만, 이를 마무리하는 과정에서 유엔으로부터 도움을 주겠다는 전화 한 통 받지 못했다”고 강조했다. 이 발언에 총회장 안에서는 탄식이 흘러나왔다. 그는 특히 유엔이 난민·이민 지원 활동을 통해 “서방 국가의 국경을 위협하고 있다”고 주장했다. 트럼프 대통령은 “유엔은 침략을 막아야지, 침략을 만들어내거나 재정을 지원해서는 안 된다”며 “미국은 외국에서 온 대규모 인구가 국경을 넘고 주권을 침해하며 범죄를 일으키는 것을 거부한다”고 말했다. 이어 “미국은 미국 국민의 것이며, 모든 나라가 자국 국민을 지키는 입장을 취하길 바란다”고 덧붙였다. 그러면서 그는 “우리의 메시지는 매우 단순하다”며 “만약 당신이 불법적으로 미국에 들어온다면 감옥에 가거나, 당신이 왔던 곳으로 돌아가거나, 어쩌면 더 먼 곳으로 가게 될 것”이라고 재차 강조했다. 그러면서 불법 이민자 단속을 인도주의적 조치라고 주장하면서, 자신의 선거운동 모자에 새겨진 문구 “트럼프는 모든 점에서 옳았다”를 언급하며 “허풍이 아니라 사실”이라고 강조했다. 트럼프 대통령의 유엔에 대한 불만은 이번 연설에서 절정에 달했다. 그는 유네스코, 인권이사회, 세계보건기구(WHO) 등 국제기구에서 탈퇴하거나 거리를 두었고, 집권 이후 유엔 분담금 납부도 사실상 중단한 상태다. 유엔에 따르면 미국은 2024년분 체납액도 아직 갚지 않았다. 트럼프 대통령은 또 팔레스타인 자치정부 수반 마흐무드 아바스의 총회 참석을 금지하고, 이란 외교관에 대한 비자 발급도 제한했다. 그는 팔레스타인을 국가로 인정한 나라들을 비난하며 “하마스 테러에 대한 보상이 될 것”이라고 말했다. 23일(현지시간) 뉴욕 유엔 총회에서 이재명 대통령이 기조연설을 하고 있다. (사진=AFP) 이재명 “내외국인 동등한 존중”…외신, 정반대 발언 주목 이같은 트럼프의 반이민 발언은 이후 이재명 대통령 발언과 비교됐다고 블룸버그통신은 비중있게 다뤘다. 이 대통령은 이날 9번째 연설에서 “대한민국에 거주하는 내외국인 모두가 사회의 동등한 구성원으로서 삶의 모든 현장에서 존중받을 수 있도록 제도와 문화를 더욱 발전시켜 나가고자 한다”고 강조했다. 블룸버그는 최근 미국 조지아주 현대차-LG에너지솔루션 배터리 공장에서 한국인 노동자들이 대거 구금된 사건을 언급하며, 이로 인해 양국 관계에 긴장이 불거졌다고 보도했다. 아울러 이 사건이 7월 말 통상·투자 협정 체결 당시 약속된 수십억 달러 규모의 한국 투자를 위태롭게 할 수 있다는 우려도 제기됐다고 전했다. 경제 성과 강조하며 “세계에서 가장 뜨거운 나라” 트럼프 대통령은 연설 후반부에서 자신이 물가를 낮추고 임금을 끌어올렸다고 자평했다. 그는 “미국은 지금 세계에서 가장 뜨거운 나라”라며 이민이 다른 나라를 파괴하고 있다고 주장했다. 또 “유엔의 역할이 무엇이냐”며 “강한 표현의 서한만 쓰고 후속 조치는 하지 않는다. 빈말은 전쟁을 끝내지 못한다. 전쟁을 끝내는 것은 행동뿐”이라고 말했다. 기후변화 부정…“사기극이자 역사상 가장 큰 속임수” 주장 트럼프 대통령은 아울러 기후변화와 재생에너지 정책을 정면으로 부정하며 사실과 다른 주장을 잇따라 내놨다. 그는 이날 연설에서 각국의 온실가스 감축 노력과 이민 정책을 “쌍두 괴물”이라고 지칭하며 비판했다. 그는 기후변화를 “사기극”이자 “역사상 가장 큰 속임수”라고 규정하며 과거의 주장을 반복했다. 그러나 수십 년간의 과학적 연구는 인류의 화석연료 사용으로 지구가 급속히 온난화되고 있음을 입증하고 있다. 트럼프 대통령은 또 재생에너지를 “한심하다”고 조롱하면서 영국의 풍력 발전 확대를 문제 삼고 북해 석유 개발을 더 적극적으로 하지 않는다고 지적했다. 풍력·태양광 단지의 대규모 건설 사례를 언급하며 “미국에서는 이런 일이 벌어지지 않을 것”이라고 강조했다. 유엔 총회에서 잘 지켜지는 외교적 불문율을 깨고 국가들을 실명 비판한 것이다. 또 “탄소 발자국(carbon footprint)도 악의적인 의도로 꾸며낸 허구”라고 주장했다. 그러나 이는 과거 석유기업 BP가 대중 홍보를 위해 널리 사용한 개념이라고 블룸버그통신은 비판했다. 영국 환경단체 업리프트(Uplift)의 테사 칸 대표는 “트럼프 대통령의 영국 에너지 정책 평가가 아세트아미노펜이 자폐증을 유발한다는 그의 주장만큼이나 신뢰하기 어렵다”고 비꼬았다. 트럼프 대통령은 취임 직후 파리기후협정에서 탈퇴했고, 이번에도 오는 11월 브라질에서 열리는 제30차 유엔 기후변화협약 당사국총회(COP30)에 미국 대표단을 파견할지 불투명하다.",김상윤 기자,2025.09.24. 오전 7:10
연합뉴스,"트럼프 ""해외기업 투자 위축 원치않아…미국인들 훈련시켜주길""",https://n.news.naver.com/mnews/article/001/0015625198?sid=104,"한국인 구금사태 의식한듯…""우리는 그들을 환영하고 직원들도 환영"" 지지층 의식해 '기술전수 위한 외국인 기한부 수용'으로 설명 도널드 트럼프 미국 대통령 [EPA=연합뉴스. 재판매 및 DB 금지] (워싱턴=연합뉴스) 이유미 특파원 = 도널드 트럼프 미국 대통령은 14일(현지시간) ""나는 다른 나라나 해외 기업들이 미국에 투자하는 것을 겁먹게 하거나 의욕을 꺾고 싶지 않다""고 말했다. 트럼프 대통령은 이날 소셜미디어 트루스소셜에서 이같이 밝힌 뒤 ""우리는 그들을 환영한다. 우리는 그들의 직원을 환영한다""고 적었다. 그러면서 ""우리는 그들로부터 배울 것이며 그렇게 머지 않은 미래에 그들의 전문 영역에서 그들보다 더 잘하게 될 것이라고 기꺼이 자랑스럽게 말할 수 있다""고 밝혔다. 트럼프 대통령이 특정 국가나 기업을 언급한 것은 아니지만, 최근 미 이민 당국에 의한 대규모 한국인 구금 사태를 의식한 발언 아니냐는 해석이 나온다. 지난 4일 미 당국은 조지아주 현대차그룹-LG에너지솔루션 합작 배터리공장 건설 현장에서 일하던 한국인 317명을 포함해 475명을 체포·구금했다. 구금됐던 한국인들은 일 주일여 만에 석방됐지만 이들 중 일부는 합법적인 비자 소지자도 포함돼 있던 것으로 전해지면서 미 당국의 과도한 단속에 대한 반발과 기업들의 투자 위축 우려가 동시에 나오는 상황이다. 트럼프 대통령은 이날 ""외국 기업들이 매우 복잡한 제품, 기계, 다양한 '것들'을 만들기 위해 막대한 투자를 가지고 미국에 들어올 때, 나는 그들이 자국의 전문 인력을 일정 기간 데려와서 그들이 미국에서 점차 철수해 자국으로 돌아갈 때까지 미국인들에게 매우 독특하고 복잡한 제품들을 어떻게 만드는지 훈련시켜 주길 바란다""고 밝혔다. 또 ""우리가 이것을 하지 않는다면, 칩, 반도체, 컴퓨터, 선박, 열차 등과 같이 우리가 다른 나라로부터 만드는 법을 배워야 하거나 많은 경우 우리가 과거에 잘했지만 지금은 다시 배워야 하는 그런 많은 제품에 대한 막대한 투자는 애초에 들어오지 않을 것""이라고 말했다. 이는 해외 기업이 미국에 투자할 때 트럼프 행정부로선 전문 인력의 지식 이전 역시 중요하게 보고 있다는 의미로 풀이된다. 한국인 구금 사태를 계기로 미국에 투자하는 한국 기업들 사이에서 미국에 당장 업무에 투입할 숙련도 있는 기술자가 없다는 지적이 제기된 데 대한 반박 차원으로도 읽힌다. 이번 트럼프 대통령의 SNS 글은 자신의 반(反) 이민 정책에 동조해온 강성 지지층과,  최근 한국인 근로자 300여명 구금 사태를 우려스럽게 보는 한국을 포함한 국제사회에 동시에 보내는 메시지로 풀이된다. 지지층에 전문기술을 가진 외국 인력을 받아들이지 않으면 미국의 제조업 기반 재건을 이룰 수 없는 현실을 설명하는 동시에, 한국을 비롯한 각국의 대미투자 기업들에는 전문 기술 인력의 미국 체류를 보장하겠다는 메시지를 던진 것으로 보인다. 다만 외국 기술인력을 받아들이는 것은 미국 국민들에게 기술을 전수하기 위함이며, 그 과업이 끝나면 자국으로 돌아간다는 점을 분명히 함으로써 외국 기술인력 유입 허용이 강경한 반이민 정책의 유연화를 의미하지는 않는다는 점도 부각했다. 한미는 한국인 근로자 구금 사태를 계기로 대미 투자 한국 기업 기술인력의 안정적 미국 체류를 보장하기 위한 비자 제도 개선 방안을 협의하고 있다. [그래픽] 미 구금·귀국 한국인 비자 현황 (서울=연합뉴스) 이재윤 기자 = 미국 조지아주에서 미 이민 당국에 체포·구금됐던 한국인 300여명이 무사히 귀국한 가운데, 업계는 미국 인력 확보와 공장 건설 지연 대응에 총력을 기울이고 있다. 트럼프 정부는 미국인 고용을 주문하고 있지만, 현장 투입 인력 교육에는 최소 6개월, 많게는 5∼6년이 걸려 업계는 ""비현실적""이라고 입을 모은다. yoon2@yna.co.kr X(트위터) @yonhap_graphics  페이스북 tuney.kr/LeYN1 yumi@yna.co.kr",이유미 기자,2025.09.15. 오전 4:23
조선일보,미국맥주를 다시 위대하게? 트럼프 반(反)이민정책에 맥주시장 지각변...,https://n.news.naver.com/mnews/article/023/0003931056?sid=104,"미국 맥주 시장 판매 1위를 달성한 미켈롭울트라/앤하이저부시 홈페이지 미국 도널드 트럼프 행정부의 반(反)이민 정책과 관세전쟁 여파가 미 맥주 시장 판도를 흔들고 있다. 24일 시장조사 업체 서카나에 따르면, 주류 회사 앤하이저부시의 맥주 ‘미켈롭 울트라’는 이달 14일까지 52주 동안 미국 소매시장 판매 1위를 기록한 것으로 나타났다. 라이벌인 멕시코 맥주 ‘모델로 에스페시알’을 2년 만에 1위 자리에서 밀어냈다. 모델로 에스페시알은 지난 1월 트럼프 대통령 취임 이후 불법 이민자 단속이 강화되면서 판매량이 눈에 띄게 줄어들었다. 모델로 에스페시알 수입사인 콘스텔레이션 브랜즈는 “정부의 대규모 추방 정책이 히스패닉 소비자를 위축시켜 매출에 타격을 주고 있다”고 했다. 모델로 소비자의 절반 이상이 히스패닉인데, 고용 불안과 가계경제 악화로 이들이 외식과 모임을 줄이면서 맥주 소비도 급감했다는 것이다. CNN은 또 다른 멕시코 맥주 ‘코로나’ 역시 판매세가 꺾이고 있다고 전했다. 여기에 멕시코산 수입품에 대한 관세가 25%로 인상되면서 가격 인상도 불가피한 상황이다. 앤하이저부시는 미켈롭 울트라를 앞세워 2년 만에 판매 1위 자리를 탈환하게 됐다. 앤하이저부시는 모델로에 앞서 간판 제품 ‘버드 라이트’로 2001년부터 20년 넘게 미국 맥주 시장 1위를 지켰다. 그러나 2023년 트랜스젠더 인플루언서에게 특별 제작한 제품을 협찬했다가 보수층의 불매운동에 타격을 입었다. 당시 한 달 만에 모델로에 1위 자리를 내줬던 앤하이저부시가 반격에 나서면서 전면에 내세운 맥주가 미켈롭 울트라다. 지난해 파리올림픽에서 미국 대표팀을 후원하고, 축구 스타 리오넬 메시를 광고 모델로 기용하는 등 공격적인 마케팅을 펼치면서 인지도를 끌어올렸다. 지난해에는 미국 내 바·레스토랑 생맥주 점유율에서 처음으로 미켈롭 울트라가 버드 라이트를 넘어서기도 했다. 조선일보 국제부가 픽한 글로벌 이슈! 원샷 국제뉴스 더보기 (https://www.chosun.com/tag/oneshot/)",김지원 기자,2025.09.24. 오후 2:36
뉴스1,"H-1B 비자 충격, 가장 피해 볼 나라는 인도가 아니라미국",https://n.news.naver.com/mnews/article/421/0008503821?sid=104,"해당기사 - BBC 갈무리 (서울=뉴스1) 박형기 기자 = 미국 트럼프 행정부의 H-1B 비자 수수료 100배 인상은 처음에는 인도에 큰 타격을 가할 것이지만, 결국 미국에 엄청난 악영향을 미치는 자충수가 될 것이라고 영국 BBC가 23일 보도했다. 백악관은 지난 19일 해외 기술 인력에 제공되는 H-1B 비자 수수료를 기존의 1000달러에서 10만달러(1.4억원)로 인상한다고 발표했다. 이민 전문가들은 10만달러의 수수료가 지나치게 높다고 일제히 비판하고 있다. 2023년 기준 신규 H-1B 직원의 평균 급여가 9만4000달러이기 때문이다. 배보다 배꼽이 더 큰 것이다. 이번 조치로 일단 인도가 가장 큰 타격을 입을 전망이다. H-1B 비자의 71%가 인도인에게 발급되기 때문이다. 그동안 인도인에게 H-1B 비자는 아메리칸드림을 실현하는 티켓이었다. 이 비자로 돈을 번 인도인들이 고향에 부동산을 사는 등 투자하면서 인도 경기는 활황을 구가할 수 있었다. 그러나 수수료 100배 인상으로 인도에서 이같은 특수는 더 이상 지속되지 않을 전망이다. 하지만 다음 피해국은 미국이 될 것이라고 BBC는 전망했다. 그 피해는 더욱 광범위하고 깊을 것이라고 덧붙였다 인도인 인력이 없으면 실리콘밸리가 마비될 것이기 때문이다. 실리콘밸리에서 일하는 인력 중 4분의 1이 인도인이다. 특히 의사 직종은 엄청난 타격을 받을 전망이다. 미국 전체 의사 중 인도인의 비중이 6%를 넘는다. 2023년 회계연도에 인도인 의사 8200명에게 H-1B 비자가 발급됐었다. 이는 당해 외국의 의사의 22%를 차지한다. 이민 정책 분석가인 길 게라는 BBC와의 인터뷰에서 “인도가 먼저 충격을 느낄 수 있지만 파급 효과는 미국에서 더 깊고 광범위할 것”이라고 전망했다. 일단 인포시스 등 인도의 IT 기업들은 현지 인력을 재구축하고 배송 시스템을 해외로 이전하는 등 오랫동안 이에 대비해 왔다. 또 인도 기업들은 수수료 폭등으로 인한 비용을 미국 소비자에게 전가할 가능성이 크다. 이에 따라 미국에 미치는 영향은 광범위하고 심각할 것이다. 의사 부족에 직면한 병원, 학생 유치에 어려움을 겪는 대학, 로비 역량이 없는 스타트업(새싹 기업) 기업에 일단 큰 충격을 줄 것이다. 이민 전문가들은 ""비자 수수료 인상은 미국 기업들이 고용 정책을 근본적으로 바꾸고 상당 부분 업무를 해외로 이전하도록 강요할 것""이라고 입을 모으고 있다. 트럼프가 미국인 일자리 보호를 위해 조치를 취했지만, 아웃소싱을 가속화 해 일자리가 오히려 줄 것이란 얘기다. 카토 연구소의 이민 연구 책임자 데이비드 비어는 ""이는 미국의 혁신과 경쟁력에 치명적인 타격을 입힐 것""이라고 말했다고 BBC는 전했다.",박형기 기자,2025.09.23. 오후 3:38
SBS,"미국의회조사국 ""구금사태로 한국의 한미관계 우려 고조돼""",https://n.news.naver.com/mnews/article/055/0001293410?sid=100,"▲ 조지아주 현대차그룹-LG에너지솔루션 직원 양손과 다리에 체인 묶는 단속요원들 미국 조지아주 현대차그룹-LG에너지솔루션 합작 배터리공장 건설 현장에서 한국인 노동자 300명 이상이 미국 이민 당국에 의해 체포·구금됐던 사태가 한미관계에 악영향 요인으로 작용하고 있다는 미국 연방의회 측 분석이 나왔습니다. 미 의회조사국(CRS)은 현지시간 지난 12일, 한미관계를 업데이트한 보고서에서 ""도널드 트럼프 대통령과 이재명 대통령간 첫 정상회담의 긍정적인 분위기에도 불구하고 한미 관계에는 도전과제가 남아 있을 수 있다""며 도전 과제 중 하나로 이번 사태를 꼽았습니다. CRS는 ""9월 4일 조지아주 한국 자동차 업체 현대의 제조 공장에서 진행된 이민 단속 작전은 양자 관계에 대한 한국의 우려를 고조시켰다""고 평가했습니다. 이어 ""미국 이민정책이 외국 투자를 통한 미국 제조업 일자리 확대라는 미국의 목표와 상충될 수 있다는 의문도 높였다""고 덧붙였습니다. 보고서는 그러면서 의회에 법안 하나가 계류돼 있으며 이 법안이 ""한국 국적자에 대한 고숙련 비자를 제공할 수 있다""고 소개했습니다. 해당 법안은 한국계인 영 김 하원의원(공화·캘리포니아)이 지난 7월 119대 의회 들어 재발의한 것으로 연간 최대 1만 5천개의 한국인 전문직 취업비자(E-4)를 발급하는 것을 골자로 합니다. CRS는 아울러 ""많은 한국 전문가는 트럼프 대통령이 대북정책을 개발하면서 서울(한국 정부)을 우회할 수 있다는 우려를 표명하고 있다""고 지적했습니다. 지난달 25일 백악관에서 열린 한미 정상회담에 대해서는 ""양국 정상은 주요 발표를 하지 않았지만, 한미 관계의 강력함과 중요성을 강조했다""고 평가했습니다. 이어 ""공동 방위비용 분담, 주한미군 병력, 대만사태를 포함한 중국의 위협에 집중하기 위해 주한미군을 재편하려는 트럼프 행정부의 의향 등 일부 잠재적 동맹 이슈를 해결하지 못한 채 남겨뒀다""고 설명했습니다. (사진=ICE 홈페이지 영상 캡쳐, 연합뉴스)",박찬범 기자,2025.09.18. 오전 12:00
헤럴드경제,"“미국인 일자리 뺏지마라”라…美 전문직비자 수수료, 1억4000만원으로...",https://n.news.naver.com/mnews/article/016/0002532299?sid=104,"블룸버그 “H-1B 수수료 현재의 100배 수준 인상 계획” “트럼프의 反이민정책 재원 마련 목적” 도널드 트럼프 미국 대통령. [EPA] [헤럴드경제=신주희 기자] 미국이 ‘전문직 비자’로 불리는 H-1B 비자의 수수료를 10만달러(약 1억4천만원)로 대폭 증액할 예정이라고 블룸버그통신이 19일(현지시간) 보도했다. 보도에 따르면 도널드 트럼프 대통령은 H-1B 비자 프로그램을 대대적으로 개편하는 포고문에 이르면 이날 서명할 예정이다. H-1B 비자는 과학·기술·공학·수학(STEM) 분야의 전문 직종에 적용되는 비자로, 추첨을 통한 연간 발급 건수가 8만5000건으로 제한돼 있다. 기본 3년 체류가 허용되며, 연장도 가능하고, 영주권도 신청할 수 있다. 트럼프 대통령은 H-1B 비자 발급이 미국인의 일자리를 빼앗는다는 인식을 갖고 있다. 중국·인도인 비중이 높은 H-1B 비자를 활용, 기업들이 저렴한 비용으로 외국 인력을 데려오면서 미국인의 일자리가 잠식된다는 것이다. 또 H-1B 비자의 ‘남용’ 탓에 미국인들이 STEM 분야에서 경력을 쌓지 않도록 하는 요인이 된다고 블룸버그가 확보한 백악관 내부 자료는 진단했다. 이에 따라 트럼프 대통령은 노동부 장관에게 H-1B 프로그램의 통상임금 수준을 수정하기 위한 규제 제정 절차에 착수하도록 지시할 방침이라고 블룸버그는 전했다. 특히 H-1B 비자가 추첨제로 운영되다 보니 인력 파견 회사들이 비자를 대량 신청하는 부작용이 나타났다고 판단, 현재 약 1000달러인 신청 수수료를 10만달러로 대폭 증액할 계획이다. 앞서 미 국토안보부 산하 이민국(USCIS)의 조셉 에들로 국장은 지난 7월 뉴욕타임스(NYT) 인터뷰에서 H-1B 비자의 발급 시스템을 바꿔 심사를 강화하겠다고 밝힌 바 있다. 블룸버그는 정부의 이번 방침과 관련, “대통령의 세금 법안에 규정된 취업 허가, 망명 신청, 인도적 보호에 대한 일련의 수수료 인상과 맞물려 나타나고 있다”며 “신규 구금시설 확보, 이민 단속 요원 채용, 국경 장벽 건설 확대를 위한 재원 확보 목적”이라고 전했다.",신주희 기자,2025.09.21. 오후 3:16
