source,title,link,content,journalist,date
동아일보,"美이민단속국서 총격, 2명 사망-1명 부상…총격범은 자살",https://n.news.naver.com/mnews/article/020/0003663467?sid=104,"댈러스서 백인 남성, 인근 건물 옥상서 ICE 구금자 저격 트럼프 불법 이민자 추방 정책과 연관땐 파장 커질 듯 (출처=The_Independent X) 미국 이민세관단속국(ICE)에서 총격 사건이 발생해 범인을 포함한 최소 4명의 사상자가 나왔다고 24일(현지 시간) 현지 언론이 보도했다. 백인 남성으로 알려진 범인은 ICE 인근 건물 옥상에서 ICE에 있던 희생자들을 저격한 뒤 스스로 목숨을 끊었다고 현지 경찰은 밝혔다. ICE는 얼마 전 조지아주 현대자동차·LG에너지솔루션 배터리 공장 건설 현장의 이민단속을 주도했던 기관이다. 범인이 백인 남성이라는 점, 범행 대상이 ICE 안에 있던 구금자(이민자)였다는 점 등을 고려하면 도널드 트럼프 행정부의 불법 이민자 추방 정책과 연관이 있을 가능성도 제기돼 파장이 주목된다. 이날 미국 뉴욕타임스(NYT) 등 외신에 따르면 이날 오전 댈러스의 ICE 사무소에서 총 3명이 총에 맞았다. 당국에 따르면 3명 중 구금자 2명이 숨졌고, 1명이 다쳤다. 사상자 중 ICE 직원은 없으나 현장 경비원들은 부상을 입었을 가능성도 있다. ICE에 따르면 범인은 외부 건물 옥상에서 ICE를 향해 총을 쏜 것으로 전해졌다. 댈러스 경찰의 통화 기록에 따르면, 40개 이상의 경찰 부대가 이날 오전 6시 40분경 스테몬스 회랑의 노스 스테몬스 고속도로 8100번지에서 발생한 사고 현장에 출동했다. ICE 국장 대행 토드 라이언스는 “현재 부상자들의 상태는 확실하지 않다”며 “현장은 안전한 상태다”라고 CNN에 전했다. 댈러스 경찰은 “용의자가 인근 건물에서 ICE 건물에 총격을 가한 것 같다”고 밝혔다. 24일(현지 시간) 오전 미국 텍사스주 댈러스에서 이민세관단속국(ICE)을 겨냥한 총격이 발생해 1명이 숨지고, 2명이 중상을 입었다. 사진은 경찰이 ICE 건물 인근 도로를 통제하고 있는 모습. 2025.09.24 댈러스=AP/뉴시스 경찰에 따르면 총격범은 백인 남성으로, 시설 인근의 변호사 사무실 옥상에서 숨진 채 발견됐다. 크리스티 노엠 미국 국토안보부 장관은 “다수의 부상자와 사망자가 발생했으며 범인은 자살한 채 발견됐다”고 밝혔다. 이어 “범행 동기에 대해 알 수 없지만, 우리 ICE 법 집행 기관이 전례 없는 폭력에 직면해 있다”며 “이 같은 일은 반드시 멈춰야 한다“고 강조했다. 범행 동기 등에 대한 수사가 필요하겠지만, 사망한 용의자가 트럼프 행정부의 이민자 추장 정책 등에 불만을 품고 범행을 저질렀을 경우 미국 내 사회적 파장이 커질 수 있다는 우려도 나온다. 사건이 벌어진 ICE 시설은 지난달에도 폭탄 테러 위협을 받았다고 외신은 전했다. 국토안보부에 따르면 지난달 25일 한 남성이 이 시설에 접근해 “내 가방에 폭탄이 들어있다”고 말했다. 해당 남성과 이번 저격범이 동일 인물인지 여부는 아직 밝혀지지 않았다. 현재까지 밝혀진 내용이 사실이라면 최근 몇 주 사이 미국에서는 찰리 커크 피격 사건에 이어 두 번째 저격 사건이 벌어진 것이다. 총기 범죄 문제가 다시 한번 사회적 화두로 떠오를 가능성도 있다. 사건 직후 테드 크루즈 상원의원은 “부상자의 회복을 위해 기도한다. 용감하게 초기 대응해준 이들에게 감사한다”고 X(트위터)에 적었다.",김예슬 기자,2025.09.24. 오후 10:22
YTN,"""미국'비자 수수료 폭탄', 각국 '인재 모시기' 기회로""",https://n.news.naver.com/mnews/article/052/0002250858?sid=104,"미국 도널드 트럼프 행정부가 전문직을 위한 H-1B 비자 수수료를 큰 폭으로 올리자 각국 정부가 이를 '인재 모셔오기' 기회로 역이용하고 있다고 외신이 보도했습니다. 영국 파이낸셜타임스(FT)를 인용한 로이터통신 보도에 따르면, 영국 정부는 H-1B 비자와 비슷한 자국 비자의 수수료를 아예 폐지하는 방안을 검토하고 있습니다. 한 당국자는 ""세계 5대 최고 대학에 다녔거나 권위 있는 상을 받은 사람을 대상으로 논의 중""이라며 ""비용을 완전히 면제하는 구상을 하고 있다""고 말했습니다. 이 방안은 트럼프 행정부의 수수료 인상 전부터 논의됐지만, 미국의 움직임에 따라 계획에 속도를 내는 것으로 분석됩니다. 중국의 경우 과학·기술·공학·수학 분야 인재 유치를 위한 새로운 비자를 다음 달 1일부터 도입할 예정이라고 로이터는 전했습니다. 이 비자가 있으면 취업 제안과 연구직을 사전 확보하지 않고도 중국에 입국해 공부하며 일할 수 있습니다. 로이터는 한국에 대해선, 강훈식 대통령 비서실장이 미국의 정책 변화를 활용해 해외 과학·공학자 유치 방안을 찾도록 각 부처에 지시했다고 전했습니다. 이어, ""한국을 포함한 여러 나라가 강경해지는 미국의 이민 정책을 유리하게 활용해, 외국인 과학자와 공학자를 끌어들이고 자국 산업을 발전시키며 인재 유출 흐름을 '유턴'시키려 한다""고 분석했습니다. 독일 디지털 산업계 연합체인 비트콤의 베른하르트 로흐레더 대표는 ""미국의 새 정책이 독일과 유럽이 최고의 인재를 끌어들이는 기회가 될 수 있다""고 말했습니다. ※ '당신의 제보가 뉴스가 됩니다' [카카오톡] YTN 검색해 채널 추가 [전화] 02-398-8585 [메일] social@ytn.co.kr",김종욱 기자,2025.09.23. 오후 4:30
머니투데이,"[칼럼] 트럼프의 골드카드와 H-1B 인상,미국 이민정책의 새 축을 짜다",https://n.news.naver.com/mnews/article/008/0005256026?sid=101,"최근 트럼프 행정부가 내놓은 두 가지 발표는 미국 이민정책의 향후 방향을 뚜렷하게 보여주었다. 첫째, 전문직 취업비자 H-1B 신규 신청 수수료를 10만 달러로 인상했고, 둘째, 개인이 100만 달러, 기업이 200만 달러를 기부하면 신속히 영주권을 부여하는 '골드카드(Gold Card)' 제도의 구체안을 공개했다. 표면적으로는 전문직 인재 유입을 억제하면서도 자본을 유치하는 상반된 조치처럼 보이지만, 실제로는 같은 축을 그리고 있다. 미국은 이제 누구나 도전할 기회의 나라가 아니라, 초고액 자산가와 세계적 수준의 인재라는 두 축을 중심으로 이민정책을 재편하고 있다. H-1B 수수료 인상은 단순한 행정 비용이 아니라 일종의 선별 장치다. 기업은 외국인을 고용할 때마다 10만 달러라는 막대한 비용을 감수해야 하므로, 평범한 전문 인력은 사실상 배제되고, 기업이 반드시 필요로 하는 핵심급 인재만 선별될 수밖에 없다. 여기에 200만 달러 기업 기부 모델이 결합되면서, ""기업이 자금을 내서라도 반드시 확보해야 하는 인재""만 미국의 문턱을 넘을 수 있다는 강한 메시지가 전달된다. 반대로 개인 100만 달러 기부 모델은 초고액 자산가 집단을 겨냥한다. 애초 제시된 500만 달러안은 실효성이 낮았지만, 이번에 금액이 100만 달러로 낮아지면서 그 범위가 수천억 원대 슈퍼리치에서 수백억 원대 자산가까지 크게 확대되었다. 무엇보다 이 모델은 EB-5와 달리 고용 창출이나 투자금 회수 의무가 없고, 자금 출처만 소명하면 되므로, 불확실성과 긴 대기 시간에 지친 자산가에게는 매력적인 선택지다. 문제는 이 제도의 법적 근거다. 의회의 승인이 필요한 새로운 비자 카테고리를 만들지 않고 기존 EB-1, EB-2 쿼터를 활용하는 방식으로 추진되는 만큼, 법적 정당성 확보가 관건이다. EB-1은 국제적 업적을 요구하므로 단순 기부만으로는 설득력이 약하다. 반면 EB-2 NIW(National Interest Waiver)는 ""미국 국익에 기여한다""는 요건을 포함하고 있어, 행정부가 거액의 기부를 국익으로 해석한다면 논리를 마련할 수 있다. 다만 이 경우 기존 EB-2 NIW 신청자들의 요건은 강화되고, 심사 기간 역시 장기화할 가능성이 크다. 동일한 카테고리에서 기부형 신청자와 능력형 신청자가 경쟁하게 되면, 그 부담은 기존 능력형 신청자에게 전가될 수 있기 때문이다. 또한 이 과정에서 초과 위임(ultra vires) 논란이 불거질 수 있다. 의회가 정한 법적 요건을 행정부가 임의로 기부로 대체하는 것은 권한을 넘어서는 행위라는 비판이다. 더구나 미국에 거주 중인 신청자가 수년간 대기하는 동안, 기부자는 몇 개월 만에 영주권을 받는다면 평등 보호(Equal Protection) 위반 소송으로 이어질 소지도 있다. 정치적으로도 ""현금을 대가로 영주권을 판다""는 비판은 피하기 어렵고, EB-5에서 엄격히 요구되는 자금 출처 심사가 골드카드에서 느슨해진다면 자금 세탁이나 안보 위협이라는 또 다른 논란으로 비화될 가능성이 크다. 골드카드의 등장은 EB-5 투자이민에도 직접적인 영향을 줄 수 있다. 단순 기부형 제도가 신설되면서 EB-5는 ""고용 창출""이라는 정책적 명분을 더욱 강조하며 차별화를 시도할 것이다. 투자자 유치를 위해 선순위 담보 제공, 수수료 인하, 조기 상환 조건 강화 등 안정성을 높이는 장치가 추가될 수 있으며, USCIS의 심사 지연 문제를 계기로 신속 심사 요구가 본격화될 수도 있다. 결국 미국 이민 시장이 골드카드와 EB-5라는 두 제도가 서로 다른 층을 겨냥하며 병존하는 구도로 재편될 가능성은 충분하다. 미국투자이민 전문기업 (주)비씨아이 존유 미국변호사 그러나 전망은 단순하지 않다. 골드카드가 실제로 법적 정당성을 확보할 수 있을지, 기존 EB-1·EB-2 신청자들의 반발을 어떻게 넘을지, 그리고 정치적 비판을 감수할 수 있을지는 여전히 불확실하다. 트럼프 행정부의 이번 행보는 분명 미국 이민정책의 지형을 크게 흔드는 사건이지만, 여러 논란과 법적 쟁점이 얽혀 있는 만큼 그 향방은 예단하기 어렵다. 확실한 것은 미국 이민의 문턱이 과거보다 훨씬 높아졌으며, 앞으로의 변화에 따라 글로벌 투자자와 기업 모두가 전략을 다시 짜야 한다는 사실뿐이다. 글 / 비씨아이의 존유 미국 변호사",,2025.09.25. 오후 4:50
SBS,"이민구금시설에 총격…총탄에 ""이민당국 반대""",https://n.news.naver.com/mnews/article/055/0001295409?sid=104,<앵커> 미국 이민당국 구금시설을 겨냥한 총격 사건이 발생해 1명이 숨지고 2명이 중상을 입었습니다. 용의자는 현장에서 숨졌는데 수사당국은 이민당국에 대한 반감 때문 범행을 저지른 걸로 보고 있습니다. 워싱턴에서 이한석 특파원입니다. <기자> 미 수사당국 관계자들이 건물 옥상을 수색하고 있습니다. 현지시간 오늘 오전 미 텍사스주 댈러스의 한 건물 옥상에서 여러 발의 총소리가 들렸습니다. [에드윈 카르도나/ 목격자 : 아들과 함께 건물 안으로 들어가려고 하는데 총소리가 들리기 시작했습니다.] 미 이민당국이 관리하는 구금시설의 현장 사무소 건물과 출입구 주변 차량을 향해 무차별 총격을 가했습니다. 시설에 수감돼 있던 3명이 총탄을 맞아 1명이 숨졌고 2명은 중상을 입었습니다. 경찰이 출동해 현장을 수색한 결과 총격범으로 추정되는 용의자는 구금시설 주변 건물 옥상에서 숨진 채 발견됐습니다. 범행 현장에서 발견된 탄피에는 이민당국을 반대하는 문구가 쓰여 있었습니다. [조 로스록 / FBI 관계자 : 용의자 근처에서 발견된 총탄에서 확인된 초기 증거에는 미 이민세관단속국에 대한 반감을 담은 메시지가 담겨 있었습니다.] 수사당국은 초기 증거분석 결과 총격 사건에 이념적 동기가 있는 걸로 보인다고 밝혔습니다. 미 국토안보부는 이민세관단속국의 법 집행에 대한 공격으로 규정했고 밴스 부통령은 이민당국에 대한 강박적인 공격이 중단돼야 한다고 말했습니다. 지난 7월 4일에는 텍사스 알바라도에 있는 구금센터 외부에서 총격을 가해 경찰관 1명이 총상을 입었습니다. 사흘 뒤에는 텍사스주 국경순찰대 시설 밖에서 27세 남성이 연방 요원들을 향해 소총으로 수십 발을 발사해 3명이 부상을 입었습니다. 이민당국 시설을 겨냥한 총격사건이 잇따르면서 트럼프 행정부의 이민정책을 둘러싼 진영 갈등도 거세지는 분위깁니다.,이한석 기자,2025.09.25. 오전 7:20
뉴스1,"[동남아시아 TODAY] 적과의 동침,미국내 동남아시아 이주민들",https://n.news.naver.com/mnews/article/421/0008512030?sid=110,"현시내 인하대학교 HK연구교수 (서울=뉴스1) 현시내 인하대학교 HK연구교수 = 지난 4일 미국 이민세관단속국(ICE)이 조지아주에 있는 배터리 공장 건설 현장에서 한국인 노동자 300여 명을 체포·구금한 사건에 대한 충격이 쉽게 가시지 않는다. 한국 기업, 특히 반도체, 조선업, 자동차 업계의 대미 투자 확대에서부터 한국인 전문직 비자 쿼터(E-4) 신설 추진 등 2기 도널드 트럼프 행정부 들어 한미동맹 강화와 경제협력 확대를 위해 진행되던 노력 또한 주춤하게 되어 앞으로의 한미 경제협력의 향방이 모호하다. 이번 사건 이전에도 미국의 이민정책은 항상 논란의 대상이었지만, 트럼프만큼 직접적으로 이민자에 적대적인 정책을 내세워 가두거나 추방한 사례는 1882년 체스터 A. 아서 대통령이 서명한 '중국인 배척법' 이후 거의 처음이라고 할 수 있다. 2차 세계 대전 시기에 이 법은 폐지되었지만, '인종의 용광로'라고 불렸던 미국의 이미지에 크나큰 오점을 남긴 것은 분명하다. 그럼에도 1970년 이민법 개정에 이르기까지 미국으로 이주했던 아시아인 대다수는 일본, 중국, 필리핀, 하와이, 그리고 한국 출신이었다. 1965년 미국이 베트남 내전에 직접 개입하게 되면서 동남아시아 출신 이민자 수가 급격히 증대한다. 특히 미국의 반공주의적 대동남아시아 정책 수행을 지지했던 남베트남, 캄보디아, 라오스 출신 난민들을 대거 받아들이기 위해, 1975년 미 의회는 '인도차이나 이주 및 난민 지원법'을 통과시킨다. 이 법으로 13만여 명의 베트남, 캄보디아, 라오스인이 미국으로 오는 교통비부터 정착 비용까지 지원받을 수 있었다. 이는 전쟁 난민에 대한 인도적 지원이라는 의미도 있었지만, 한편으로는 미국이 파병과 폭격을 통해 세 국가의 내전을 국제전으로 확대했음에도 공산화를 막지 못했다는 데에 대해 상징적으로나마 책임을 진다는 점에서 의의가 남달랐다. 이에 1980년대부터 2010년대까지 미국으로 이주한 아시아 이주민 중 동남아시아 출신이 다수를 차지하게 된다. 1975년 인도차이나 이주 및 난민 지원법을 통과시킬 때도 많은 논란이 있었다. 보수파 정치인과 평론가들은 인도차이나 출신 이주민이 미국 사회에 동화되기도 어려울뿐더러 미국 국민의 세금으로 이들의 취업을 보장하는 것은 형평성에 어긋난다고 주장했다. 이에 제럴드 포드 행정부는 지역 경제에 영향을 미치지 않기 위해, 그리고 이주자의 문화와 미국 문화의 충돌을 막기 위해 난민 정착지 분산 정책을 시행했다. 이에 다수의 아시아 출신 이주민들은 개발이 덜 이루어진 외지나 저임금 노동자에 대한 수요가 높은 도시 변두리에 정착하게 된다. 1975년 패전 직후 미국으로 건너간 베트남, 라오스, 캄보디아 출신의 이주민 다수는 공산당의 보복을 두려워했던 고위급 공무원이나 군인들, 그의 가족들이었지만, 이후 고국을 등져야 했던 이들은 삶의 터전 자체를 상실한 난민들이었다. 이들이 경작했던 논과 밭은 네이팜탄 공격에 초토화되어 버렸고, 집과 일터는 송두리째 사라져 버렸다. 1976년 이후 공산당 정권 아래 이전 반공 정권과 협력했다고 의심되어 수용소로 보내지거나 사유재산을 몰수당하는 이들이 늘어나면서, 인도차이나에서 탈출하는 난민들의 숫자가 급격히 증대되기 시작한다. 특히 1979년 중국-베트남 전쟁 이후 수십만 명의 남베트남인들이 바다를 통해 탈출을 시도해 '보트피플'이라는 용어가 만들어질 정도였다. 이렇게 자유를 찾아 떠났지만, 식수와 식량 부족, 해적의 공격 등으로 다시 육지를 밟지 못하거나, 수년간의 사투 끝에 미국에 도착해도 1975년에 도착했던 이들과는 달리 정착 비용이나 취업 등에 대한 지원을 거의 받지 못했다. 가난과 불평등은 이렇게 자유와 부의 상징이었던 미국에서도 대물림되었다. 지난 8월 4일(현지시간) 미국 뉴욕의 테드 바이스 연방 빌딩에서 불법 이민 단속 업무를 맡는 한 연방 요원이 도널드 트럼프 대통령과 JD 밴스 부통령의 초상화가 걸린 복도를 걸어가고 있다. 2025.08.04 ⓒ AFP=뉴스1 ⓒ News1 김지완 기자 2016년 트럼프 1기 행정부 출범 이후 백인우월주의와 고립주의로의 회귀는 미국 내 14.3%에 달하는 이민자에게 있어 악몽과도 같다. 8월 28일 자 CNN 기사에 따르면 지난 1월 트럼프 2기 행정부 출범 이후 7개월간 이민세관단속국에 의해 추방당한 이민자가 20만 명에 달한다고 한다. 이민세관단속국이 2024년에 발표한 보고서에 따르면 비시민권자에 대한 체포와 구금을 담당한 '집행 및 제거 작전'(ERO) 팀에 의한 체포는 지속적으로 증대됐다. 특이한 점은 2020년 이전에는 형사 유죄 판결을 받거나 형사 기소가 진행 중인 비시민권자에 대한 체포 및 추방이 다수였던 반면, 2020년 이후부터 이민법 위반 비시민권자에 대한 체포와 추방이 급격히 증대되었다는 것이다. 이와 함께 눈여겨볼 만한 점은 2010년대 이후부터 미국에서 태어난 이주민 자손이라 하더라도 교통신호 위반과 같은 경범죄나 범죄단체 의심 조직 연루 가능성 등의 이유로 부모의 고국으로 추방되는 사례 역시 눈에 띄게 늘었다는 것이다. 범죄에 연루된 이주민에 대한 체포 및 추방 비율이 높은 이유는 여러 가지로 설명될 수 있지만, 무엇보다도 2008년 이후 지속된 미국의 경제위기와 실직률 증가, 사회적 혼란의 증대 등을 꼽을 수 있다. 이로 인한 불안과 불만이 난민과 이주민에 대한 반감과 증오로 폭발한 것이다. 동남아시아에서 미국으로 이주한 다수의 이주자와 난민들은 저소득층에 속했고, 정착지 분산 정책에 의해 특정 지역에 집중되었다. 그렇게 미국 사회로부터 고립되어, 흑인이나 라틴계 이주민과 함께 편견과 차별의 대상이 되어왔다. 이는 미국의 대표적 보수파 배우이자 영화감독인 클린트 이스트우드가 만든 '그란 토리노'(Gran Torino·2008)라는 영화의 배경이 되었던 라오스 출신 '몽' 이주민 공동체에 대한 묘사에서도 잘 보인다. 전쟁으로 잿더미가 되어버린 고향에서 탈출해 빈털터리로 미국에 도착해 바닥에서부터 삶을 일궈온 전쟁 난민과 그들의 자손 다수가 여전히 가난하고 불평등한 삶을 힘들게 이어나가고 있다. 하지만 이들에 대한 지속적인 인종적 편견과 차별, 그리고 사회적 고립은 동남아시아 이주민을 불법체류자와 사회 부적응자로 만들고 있다. 트럼프 이전에도 트럼프는 분명 존재했다. 그래서 지금의 한미 경제협력이 맞닥뜨린 위기가 새롭지 않다. 미국 이민세관단속국 ICE(U.S. Immigration and Customs Enforcement)가 조지아주 내 현대자동차그룹과 LG에너지솔루션 합작 배터리 공장 건설 현장의 한국인 직원 300여 명을 기습 단속·구금하는 영상을 공개했다. (ICE 홈페이지. 재판매 및 DB금지) 2025.9.6/뉴스1",,2025.09.27. 오전 7:00
